PROMOCION;MES;SKU ;PRODUCTO;LABORATORIO;FECHA;DESCUENTO
;25 DEL MES;22257;Apivita Express Beauty Face Mask Green Clay Sachets 2 X 8 Ml;APIVITA;25 DE February;25%
;25 DEL MES;22258;Apivita Express Beauty Face Mask Propolis Sachets 2 X 8 Ml;APIVITA;25 DE February;25%
;25 DEL MES;22259;Apivita Aqua Beelicious Booster Serum X 30Ml;APIVITA;25 DE February;25%
;25 DEL MES;22260;Apivita Aqua Beelicious Gel Contorno Ojos X 15Ml;APIVITA;25 DE February;25%
;25 DEL MES;22261;Apivita Aqua Beelicious Oil-Free Gel Crema X 40Ml;APIVITA;25 DE February;25%
;25 DEL MES;22262;Apivita Bee Radiant Contorno Ojos X 15Ml;APIVITA;25 DE February;25%
;25 DEL MES;22263;Apivita Bee Radiant Gel-Cream Light X 50Ml;APIVITA;25 DE February;25%
;25 DEL MES;22264;Apivita Bee Radiant Serum X 30Ml;APIVITA;25 DE February;25%
;25 DEL MES;22265;Apivita Black Detox Cleansing Face & Eyes Gel X 150 Ml;APIVITA;25 DE February;25%
;25 DEL MES;22266;Apivita Cleansing Face & Eyes Creamy Foam X 200Ml;APIVITA;25 DE February;25%
;25 DEL MES;22267;Apivita Express Beauty Eye Mask Ginkgo Biloba Sachets 2 X 2 Ml;APIVITA;25 DE February;25%
;25 DEL MES;22268;Apivita Express Beauty Face Mask Aloe Sachets 2 X 8Ml;APIVITA;25 DE February;25%
;25 DEL MES;22269;Apivita Express Beauty Face Mask Cucumber Sachets 2 X 8Ml;APIVITA;25 DE February;25%
;25 DEL MES;22270;Apivita Express Beauty Face Mask Grape Sachets 2 X 8Ml;APIVITA;25 DE February;25%
;25 DEL MES;22271;Apivita Express Beauty Face Mask Olive Sachets 2 X 8Ml;APIVITA;25 DE February;25%
;25 DEL MES;22272;Apivita Express Beauty Face Mask Orange Sachets 2 X 8Ml;APIVITA;25 DE February;25%
;25 DEL MES;22273;Apivita Express Beauty Face Mask Prickly Pear Sachets 2 X 8Ml;APIVITA;25 DE February;25%
;25 DEL MES;22274;Apivita Express Beauty Face Mask Royal Jelly Sachtes 2 X 8Ml;APIVITA;25 DE February;25%
;25 DEL MES;22275;Apivita Hand Cream Dry-Chapped Hands X 50Ml;APIVITA;25 DE February;25%
;25 DEL MES;22276;Apivita Hand Cream Intensive Moisturizing X 50Ml;APIVITA;25 DE February;25%
;25 DEL MES;22277;Apivita Men’S Tonic Shampoo - Anticaída X 250 Ml;APIVITA;25 DE February;25%
;25 DEL MES;22278;Apivita Moisturizing Hair Mask X 200 Ml;APIVITA;25 DE February;25%
;25 DEL MES;22279;Apivita Hydration Moisturizing Shampoo X 250 Ml;APIVITA;25 DE February;25%
;25 DEL MES;22280;Apivita Oily Roots & Dry Ends Shampoo X 250 Ml;APIVITA;25 DE February;25%
;25 DEL MES;22281;Apivita Purifying Cleansing Gel Face X 200Ml;APIVITA;25 DE February;25%
;25 DEL MES;22282;Apivita Shampoo Daily Care X 250 Ml;APIVITA;25 DE February;25%
;25 DEL MES;22283;Apivita Wine Elixir Anti-Wrinkle Cream Light X 50 Ml;APIVITA;25 DE February;25%
;25 DEL MES;22284;Apivita Wine Elixir Anti-Wrinkle Eye And Lip Contour X 15 Ml;APIVITA;25 DE February;25%
;25 DEL MES;22285;Apivita Wine Elixir Anti-Wrinkle Serum X30 Ml;APIVITA;25 DE February;25%
;25 DEL MES;22286;Apivita Women’S Tonic Shampoo Anticaída X 250 Ml;APIVITA;25 DE February;25%
;25 DEL MES;22303;Apivita Daily Care Conditioner X 150 Ml;APIVITA;25 DE February;25%
;25 DEL MES;22304;Apivita Moisturizing Conditioner X 150 Ml;APIVITA;25 DE February;25%
;25 DEL MES;22305;Apivita Tonic Thinning Hair Conditioner X 150 Ml;APIVITA;25 DE February;25%
;25 DEL MES;22325;Apivita Color Seal Color Protect Conditioner X 150 Ml;APIVITA;25 DE February;25%
;25 DEL MES;22325;Apivita Color Seal Color Protect Hair Mask X 200 Ml;APIVITA;25 DE February;25%
;25 DEL MES;22326;Apivita Color Seal Color Protect Shampoo X 250 Ml;APIVITA;25 DE February;25%
;25 DEL MES;22327;Apivita Cleansing Milk 3 En 1 - Face & Eyes X 200 Ml;APIVITA;25 DE February;25%
;25 DEL MES;04006;Photoderm Akn Mat Spf 30 X 40 Ml Bioderma;BIODERMA;25 DE February;25%
;25 DEL MES;04010;Photoderm Spray 50+ X 200 Ml Bioderma;BIODERMA;25 DE February;25%
;25 DEL MES;04012;Sebium Gel X 200 Ml Bioderma;BIODERMA;25 DE February;25%
;25 DEL MES;04014;Sebium H2O X 250 Ml Bioderma;BIODERMA;25 DE February;25%
;25 DEL MES;04015;Sensibio Forte Crema X 40 Ml Bioderma;BIODERMA;25 DE February;25%
;25 DEL MES;04016;Sensibio H2O Solucion X 250 Ml Bioderma;BIODERMA;25 DE February;25%
;25 DEL MES;04017;Sensibio H2O X 500 Ml Bioderma;BIODERMA;25 DE February;25%
;25 DEL MES;04018;Sensibio Ar X 40 Ml Bioderma;BIODERMA;25 DE February;25%
;25 DEL MES;04019;Sensibio Ds X 40 Ml Bioderma;BIODERMA;25 DE February;25%
;25 DEL MES;04020;Sensibio Eye Contorno Ojos X 15 Ml Bioderma;BIODERMA;25 DE February;25%
;25 DEL MES;04021;Hydrabio Serum X 40 Ml Bioderma;BIODERMA;25 DE February;25%
;25 DEL MES;04024;Atoderm Crema Ultra X 500 Ml Bioderma;BIODERMA;25 DE February;25%
;25 DEL MES;04025;Sensibio H20 X 100 Ml Bioderma;BIODERMA;25 DE February;25%
;25 DEL MES;04027;Sebium Pore Refiner X 30 Ml Bioderma;BIODERMA;25 DE February;25%
;25 DEL MES;04029;Sebium Hydra Cr X 40 Ml Bioderma;BIODERMA;25 DE February;25%
;25 DEL MES;04031;Atoderm Gel Douche X 1 Lt Bioderma;BIODERMA;25 DE February;25%
;25 DEL MES;4032;Photoderm Bronz Spf 30+ X 200 Ml;BIODERMA;25 DE February;25%
;25 DEL MES;04039;Sebium Gel X 100 Ml Bioderma;BIODERMA;25 DE February;25%
;25 DEL MES;04047;Sensibio Ar Bb Cream X 40 Ml Bioderma;BIODERMA;25 DE February;25%
;25 DEL MES;04048;Atoderm Gel Douche X 100 Ml Bioderma;BIODERMA;25 DE February;25%
;25 DEL MES;04052;Sebium Global Crema X 30 Ml Bioderma;BIODERMA;25 DE February;25%
;25 DEL MES;04057;Sensibio Light X 40 Ml Bioderma;BIODERMA;25 DE February;25%
;25 DEL MES;04058;Hydrabio H2O X 250 Ml Bioderma;BIODERMA;25 DE February;25%
;25 DEL MES;04063;Photoderm Aquafluido Spf50+ Sin Color X 40Ml Bioderma;BIODERMA;25 DE February;25%
;25 DEL MES;04064;Photoderm Aquafluido Spf50+ Tono Claro Light X 40Ml Bioderma;BIODERMA;25 DE February;25%
;25 DEL MES;04072;Hydrabio Crema X 50Ml Bioderma;BIODERMA;25 DE February;25%
;25 DEL MES;04074;Hydrabio Perfecteur Spf30 X 40Ml Bioderma;BIODERMA;25 DE February;25%
;25 DEL MES;04075;Cicabio Spf50+ X 30Ml Bioderma;BIODERMA;25 DE February;25%
;25 DEL MES;04076;Sensibio Gel Moussant X 200Ml Bioderma;BIODERMA;25 DE February;25%
;25 DEL MES;04077;Photoderm M Spf50+ Teinte Doree X 40Ml Bioderma;BIODERMA;25 DE February;25%
;25 DEL MES;04079;Sebium H2O X 500 Ml Bioderma;BIODERMA;25 DE February;25%
;25 DEL MES;04080;Atoderm Intensive Baume X 500Ml Bioderma;BIODERMA;25 DE February;25%
;25 DEL MES;04083;Sebium H2O X 100 Ml Bioderma;BIODERMA;25 DE February;25%
;25 DEL MES;04084;Photoderm Nude Touch Claire Light Tinte Spf 50+ X40Ml Bioderma;BIODERMA;25 DE February;25%
;25 DEL MES;04085;Sensibio H2O X 250 2 Und + Porta Pomis + Muestra De Sensibio Ojos;BIODERMA;25 DE February;25%
;25 DEL MES;04087;Sensibio H2O Toallitas X 25 Unidades Bioderma;BIODERMA;25 DE February;25%
;25 DEL MES;04089;Sebium Gel X 500 Ml Bioderma;BIODERMA;25 DE February;25%
;25 DEL MES;04090;Photoderm Nude Touch Very Ligth Tinte Spf 50+ X 40 Ml Bioderma;BIODERMA;25 DE February;25%
;25 DEL MES;04091;Photoderm Nude Touch Dore Tinte Spf 50+ 40 Ml Bioderma;BIODERMA;25 DE February;25%
;25 DEL MES;04095;Atoderm Aceite De Ducha X 1 Litro Bioderma;BIODERMA;25 DE February;25%
;25 DEL MES;04096;Atoderm Aceite De Ducha X 100 Ml Bioderma;BIODERMA;25 DE February;25%
;25 DEL MES;04100;Atoderm Sos Spray X 50 Ml;BIODERMA;25 DE February;25%
;25 DEL MES;04101;Atoderm Sos Spray X 200 Ml Bioderma;BIODERMA;25 DE February;25%
;25 DEL MES;04102;Photoderm Spot Age Spf 50 X 40 Ml Bioderma;BIODERMA;25 DE February;25%
;25 DEL MES;04103;Sensibio Ds Gel Limpiador X 200Ml Bioderma;BIODERMA;25 DE February;25%
;25 DEL MES;04106;Sebium Mat Control X 30 Ml Bioderma;BIODERMA;25 DE February;25%
;25 DEL MES;04110;Osmoclean Creme Douce Desincrustante X 75Ml Esthederm;BIODERMA;25 DE February;25%
;25 DEL MES;04139;Pigmentbio Sensitive Areas X 75 Ml Bioderma;BIODERMA;25 DE February;25%
;25 DEL MES;04140;Pigmentbio C-Concentrate X 15 Ml Bioderma;BIODERMA;25 DE February;25%
;25 DEL MES;04141;Pigmentbio H2O X 250 Ml Bioderma;BIODERMA;25 DE February;25%
;25 DEL MES;04142;Pigmentbio Foaming Cream X 200 Ml Bioderma;BIODERMA;25 DE February;25%
;25 DEL MES;04143;Pigmentbio Nigth Renewer X 50 Ml Bioderma;BIODERMA;25 DE February;25%
;25 DEL MES;4144;Sensibio Gel Moussant X 500Ml Bioderma;BIODERMA;25 DE February;25%
;25 DEL MES;04145;Photoderm Cover Touch Claire X 40Ml Bioderma;BIODERMA;25 DE February;25%
;25 DEL MES;04146;Photoderm Cover Touch Dore X 40Ml Bioderma;BIODERMA;25 DE February;25%
;25 DEL MES;04147;Atoderm Gel Douche X 500Ml Bioderma;BIODERMA;25 DE February;25%
;25 DEL MES;04004;Atoderm Intensive Gel Creme X 500Ml Bioderma;BIODERMA;25 DE February;25%
;25 DEL MES;04149;Atoderm Gel Douche X 200 Ml Bioderma;BIODERMA;25 DE February;25%
;25 DEL MES;04150;Sensibio Gel Moussant X 100Ml Bioderma;BIODERMA;25 DE February;25%
;25 DEL MES;04151;Atoderm Crema X 200 Ml Bioderma;BIODERMA;25 DE February;25%
;25 DEL MES;04152;Atoderm Intensive Gel Crema X 200 Ml Bioderma;BIODERMA;25 DE February;25%
;25 DEL MES;04156;Photoderm Max 100 Fluide Invisible X 40 Ml Bioderma;BIODERMA;25 DE February;25%
;25 DEL MES;04157;Photoderm Max 100 Fluide Claro X 40 Ml Bioderma;BIODERMA;25 DE February;25%
;25 DEL MES;04158;Photoderm Max 100 Fluide Muy Claro X 40 Ml Bioderma;BIODERMA;25 DE February;25%
;25 DEL MES;04159;Sebium Actif Gel Moussant X 200 Ml Bioderma;BIODERMA;25 DE February;25%
;25 DEL MES;04163;Sensibio H2O Ojos Desmaquillante Bifasico X 125 Ml Bioderma;BIODERMA;25 DE February;25%
;25 DEL MES;04164;Sensibio Defensive X 40 Ml Bioderma;BIODERMA;25 DE February;25%
;25 DEL MES;04165;Sensibio Defensive Rich X 40 Ml Bioderma;BIODERMA;25 DE February;25%
;25 DEL MES;04166;Photoderm M Spf50+ Teinte Claire X 40Ml Bioderma;BIODERMA;25 DE February;25%
;25 DEL MES;04004;Atoderm Pain Surgras X 150 Gr Bioderma;BIODERMA;25 DE February;25%
;25 DEL MES;04005;Node D.S Shampoo X 125 Ml Bioderma;BIODERMA;25 DE February;25%
;25 DEL MES;04167;Sebium Gel Tubo X 200 Ml Bioderma;BIODERMA;25 DE February;25%
;25 DEL MES;04168;Sensibio Defensive Serum X 30 Ml Bioderma;BIODERMA;25 DE February;25%
;25 DEL MES;12043;Cetaphil Barra Limpieza Profunda X 127 Gr Galderma;CETAPHIL- GALDERMA;25 DE February;25%
;25 DEL MES;12007;Cetaphil Barra X 127 Gr Galderma;CETAPHIL- GALDERMA;25 DE February;25%
;25 DEL MES;12061;Cetaphil Crema Facial Noche X 48 Gr Galderma;CETAPHIL- GALDERMA;25 DE February;25%
;25 DEL MES;12010;Cetaphil Crema Hidratan. X 453 Gr Galderma;CETAPHIL- GALDERMA;25 DE February;25%
;25 DEL MES;12011;Cetaphil Emulsion Hidratante X 473 Ml Galderma;CETAPHIL- GALDERMA;25 DE February;25%
;25 DEL MES;12068;Cetaphil Healthy Hygiene Crema Protectora X 50Ml;CETAPHIL- GALDERMA;25 DE February;25%
;25 DEL MES;12067;Cetaphil Healthy Hygiene Limpiador Líquido X 237 Ml;CETAPHIL- GALDERMA;25 DE February;25%
;25 DEL MES;12044;Cetaphil Hidratante Facial Diario Spf 50 X 50 Ml Galderma;CETAPHIL- GALDERMA;25 DE February;25%
;25 DEL MES;12012;Cetaphil Limpiador Piel Sens.X 473 Ml Galderma;CETAPHIL- GALDERMA;25 DE February;25%
;25 DEL MES;12036;Cetaphil Limpiador Piel Sensible. X 237 Ml Galderma;CETAPHIL- GALDERMA;25 DE February;25%
;25 DEL MES;12062;Cetaphil Locion Hidratante De Dia X 88 Gr Galderma;CETAPHIL- GALDERMA;25 DE February;25%
;25 DEL MES;12041;Cetaphil Locion Ultra Humectante X 473 Galderma;CETAPHIL- GALDERMA;25 DE February;25%
;25 DEL MES;12071;Cetaphil Optimal Hydration Contorno De Ojos X 15 Ml Galderma;CETAPHIL- GALDERMA;25 DE February;25%
;25 DEL MES;12072;Cetaphil Optimal Hydration Crema Facial Dia X 48 Gr Galderma;CETAPHIL- GALDERMA;25 DE February;25%
;25 DEL MES;12075;Cetaphil Optimal Hydration Crema Noche X 48 Gr Galderma;CETAPHIL- GALDERMA;25 DE February;25%
;25 DEL MES;12073;Cetaphil Optimal Hydration Serum Facial 48H X 30 Ml Galderma;CETAPHIL- GALDERMA;25 DE February;25%
;25 DEL MES;12015;Cetaphil Piel Grasa X 237 Ml Galderma;CETAPHIL- GALDERMA;25 DE February;25%
;25 DEL MES;12045;Cetaphil Pro Ac Control Hidrat Spf 30 X 118 Ml Galderma;CETAPHIL- GALDERMA;25 DE February;25%
;25 DEL MES;12046;Cetaphil Pro Ac Espuma Dermacontrol X 236 Ml Galderma;CETAPHIL- GALDERMA;25 DE February;25%
;25 DEL MES;12040;Cetaphil Pro Ad Hidratante X 295 Ml Galderma;CETAPHIL- GALDERMA;25 DE February;25%
;25 DEL MES;12039;Cetaphil Pro Ad Limpiador 295 Ml Galderma;CETAPHIL- GALDERMA;25 DE February;25%
;25 DEL MES;12078;Cetaphil Pro Ar Calm Control Crema Spf30 X 50 Gr Galderma;CETAPHIL- GALDERMA;25 DE February;25%
;25 DEL MES;12077;Cetaphil Pro Ar Calm Control Espuma Limpiadora X 236 Ml Galderma;CETAPHIL- GALDERMA;25 DE February;25%
;25 DEL MES;120063;Cetaphil Sun 50+ Ultra Matte X 50Ml Oil Control Galderma;CETAPHIL- GALDERMA;25 DE February;25%
;25 DEL MES;120064;Cetaphil Sun 50+ Color Ultra Matte X 50Ml Oil Control Galderma;CETAPHIL- GALDERMA;25 DE February;25%
;25 DEL MES;120065;Cetaphil Sun 50+ Gel Ligero Facial Y Corporal X 50 Ml;CETAPHIL- GALDERMA;25 DE February;25%
;25 DEL MES;12049;Cetaphil Sun Fps 50+ Gel Ligero X 100 Ml;CETAPHIL- GALDERMA;25 DE February;25%
;25 DEL MES;12050;Cetaphil Sun Kids Spf 50 X 150 Ml Galderma;CETAPHIL- GALDERMA;25 DE February;25%
;25 DEL MES;12033;Cetaphil Ultra Humectante X 226 Gr Galderma;CETAPHIL- GALDERMA;25 DE February;25%
;25 DEL MES;12079;Cetaphil Optimal Hydration Water Gel X 48 Gr Galderma;CETAPHIL- GALDERMA;25 DE February;25%
;25 DEL MES;12080;Cetaphil Healthy Renew Ojos X 15 Gr Galderma;CETAPHIL- GALDERMA;25 DE February;25%
;25 DEL MES;12081;Cetaphil Healthy Renew Serum Facial X 30 Gr Galderma;CETAPHIL- GALDERMA;25 DE February;25%
;25 DEL MES;12082;Cetaphil Healthy Renew Crema De Noche X 50 Gr Galderma;CETAPHIL- GALDERMA;25 DE February;25%
;25 DEL MES;12083;Cetaphil Gel Crema Calmante X 226 Gr Galderma;CETAPHIL- GALDERMA;25 DE February;25%
;25 DEL MES;12163;Cetaphil Piel Grasa X 473 Ml Galderma;CETAPHIL- GALDERMA;25 DE February;25%
;25 DEL MES;12070;Cetaphil Urea 20% Crema Hidratante Restauradora X 296 Ml Galderma;CETAPHIL- GALDERMA;25 DE February;25%
;25 DEL MES;80045;Vitix Tabletas X 30 Unidades Ecopharma;ECOPHARMA COLOMBIA;25 DE February;25%
;25 DEL MES;80070;Sebionex Locion Micelar X 250 Ml Ecopharma;ECOPHARMA COLOMBIA;25 DE February;25%
;25 DEL MES;80071;Medisun Crema Mineral Light Spf 50+ X 40 Ml Ecopharma;ECOPHARMA COLOMBIA;25 DE February;25%
;25 DEL MES;80072;Boreade CL Limpiador X 200 Ml Ecopharma;ECOPHARMA COLOMBIA;25 DE February;25%
;25 DEL MES;80040;Bioxet Gel Reductor De Vello Corporal X 60Ml Ecopharma;ECOPHARMA COLOMBIA;25 DE February;25%
;25 DEL MES;80041;Bioxet Gel Reductor De Vello Facial X 30Ml Ecopharma;ECOPHARMA COLOMBIA;25 DE February;25%
;25 DEL MES;80067;Boreade Global-Antiimperfecciones X 40 Ml Ecopharma;ECOPHARMA COLOMBIA;25 DE February;25%
;25 DEL MES;80068;Boreade M Seborregulador Matificante X 40 Ml Ecopharma;ECOPHARMA COLOMBIA;25 DE February;25%
;25 DEL MES;80069;Boreade SL Alisante X 40 Ml Ecopharma;ECOPHARMA COLOMBIA;25 DE February;25%
;25 DEL MES;80007;Cicastim Crema X 20Ml Ecopharma;ECOPHARMA COLOMBIA;25 DE February;25%
;25 DEL MES;80001;Depiwhite Advanced Crema X 40Ml Ecopharma;ECOPHARMA COLOMBIA;25 DE February;25%
;25 DEL MES;80006;Depiwhite Body Milk X 200Ml Ecopharma;ECOPHARMA COLOMBIA;25 DE February;25%
;25 DEL MES;80003;Depiwhite Contorno De Ojos Gel X 15Ml Ecopharma;ECOPHARMA COLOMBIA;25 DE February;25%
;25 DEL MES;80005;Depiwhite Dia Spf 20 X 40Ml Ecopharma;ECOPHARMA COLOMBIA;25 DE February;25%
;25 DEL MES;80051;Depiwhite M Spf 50+ X 40Ml Ecopharma;ECOPHARMA COLOMBIA;25 DE February;25%
;25 DEL MES;80004;Depiwhite Peel Off Mask X 40 Ml Ecopharma;ECOPHARMA COLOMBIA;25 DE February;25%
;25 DEL MES;80044;Duolys C.E Serum Antioxidante X 15Ml Ecopharma;ECOPHARMA COLOMBIA;25 DE February;25%
;25 DEL MES;80048;Duolys Contorno De Ojos En Crema X 15Ml Ecopharma;ECOPHARMA COLOMBIA;25 DE February;25%
;25 DEL MES;80047;Duolys Hyalserum Intensivo Antioxidante X 15Ml Ecopharma;ECOPHARMA COLOMBIA;25 DE February;25%
;25 DEL MES;80050;Duolys Legere X 40 Ml Ecopharma;ECOPHARMA COLOMBIA;25 DE February;25%
;25 DEL MES;80049;Duolys Spf 50+Crema Solaire Antiage X 50 Ml Ecopharma;ECOPHARMA COLOMBIA;25 DE February;25%
;25 DEL MES;80064;Duolys.A Antiarrugas X 30 Ml Ecopharma;ECOPHARMA COLOMBIA;25 DE February;25%
;25 DEL MES;80021;Laviderm Bionic Complex Gel X 30 Ml;ECOPHARMA COLOMBIA;25 DE February;25%
;25 DEL MES;80022;Lavigor Regenhial Gel X 50 Ml Ecopharma;ECOPHARMA COLOMBIA;25 DE February;25%
;25 DEL MES;80066;Medisun Gel Matificante Spf 50+ X 40 Ml Ecopharma;ECOPHARMA COLOMBIA;25 DE February;25%
;25 DEL MES;80065;Medisun Spray Spf 50+ X 200 Ml Ecopharma;ECOPHARMA COLOMBIA;25 DE February;25%
;25 DEL MES;80011;Novophane Ds Champu X 125 Ml Ecopharma;ECOPHARMA COLOMBIA;25 DE February;25%
;25 DEL MES;80010;Novophane Energizante Shampoo X 200 Ml Ecopharma;ECOPHARMA COLOMBIA;25 DE February;25%
;25 DEL MES;80009;Novophane K Champu X 125 Ml Ecopharma;ECOPHARMA COLOMBIA;25 DE February;25%
;25 DEL MES;80008;Novophane Locion Capilar X 100 Ml;ECOPHARMA COLOMBIA;25 DE February;25%
;25 DEL MES;80025;Novophane Sebo Regulador Shampoo X 200 Ml Ecopharma;ECOPHARMA COLOMBIA;25 DE February;25%
;25 DEL MES;80046;Novophane X 60 Capsulas Ecopharma;ECOPHARMA COLOMBIA;25 DE February;25%
;25 DEL MES;80052;Sebionex Actimat X 40 Ml Ecopharma;ECOPHARMA COLOMBIA;25 DE February;25%
;25 DEL MES;80027;Sebionex Foaming Gel X 200Ml Ecopharma;ECOPHARMA COLOMBIA;25 DE February;25%
;25 DEL MES;80037;Sebionex K Crema X 40 Ml Ecopharma;ECOPHARMA COLOMBIA;25 DE February;25%
;25 DEL MES;80029;Sebionex Trio Crema Correctiva X 40 Ml Ecopharma;ECOPHARMA COLOMBIA;25 DE February;25%
;25 DEL MES;80030;Sensitelial Locion Micelar X 250 Ml Ecopharma;ECOPHARMA COLOMBIA;25 DE February;25%
;25 DEL MES;80031;Sensitelial Matificante Gel Spf 50 X 40 Ml;ECOPHARMA COLOMBIA;25 DE February;25%
;25 DEL MES;80054;Sensitelial Mineral 50+ Tinte Oferta;ECOPHARMA COLOMBIA;25 DE February;25%
;25 DEL MES;80013;Viticolor Gel Camouflage X 50 Ml Ecopharma;ECOPHARMA COLOMBIA;25 DE February;25%
;25 DEL MES;10001;Aceite De Ducha X 200 Ml Eucerin;EUCERIN;25 DE February;25%
;25 DEL MES;10009;Dermopure Oil Control Gel Limpiador Facial X 200 Ml Eucerin;EUCERIN;25 DE February;25%
;25 DEL MES;100104;Pomitos Desmaquillantes X 50 Unidades Eucerin;EUCERIN;25 DE February;25%
;25 DEL MES;10011;Hyaluron Filler Dia X 50 Ml Eucerin;EUCERIN;25 DE February;25%
;25 DEL MES;10012;Hyaluron Filler Noche X 50 Ml Eucerin;EUCERIN;25 DE February;25%
;25 DEL MES;10013;Hyaluron Filler Contorno De Ojos X 15 Ml Eucerin;EUCERIN;25 DE February;25%
;25 DEL MES;10016;Protector Labial X 4.8 Gr Eucerin;EUCERIN;25 DE February;25%
;25 DEL MES;10017;Crema Reparadora Para Pies 10% X 100 Ml Eucerin;EUCERIN;25 DE February;25%
;25 DEL MES;10020;Ph5 Crema Rostro X 75 Ml Eucerin;EUCERIN;25 DE February;25%
;25 DEL MES;10021;Ph5 Locion X 250 Ml Eucerin;EUCERIN;25 DE February;25%
;25 DEL MES;10025;Ph5 Syndet Gel X 250Ml Eucerin;EUCERIN;25 DE February;25%
;25 DEL MES;10026;Q10 Active Crema Facial Dia X 50 Ml Eucerin;EUCERIN;25 DE February;25%
;25 DEL MES;10027;Q10 Active Crema Facial Noche X 50 Gr Eucerin;EUCERIN;25 DE February;25%
;25 DEL MES;10029;Q10 Ojos X 15 Ml Eucerin;EUCERIN;25 DE February;25%
;25 DEL MES;10037;Hidrofugal Classic Barra X 40Gr Eucerin;EUCERIN;25 DE February;25%
;25 DEL MES;10038;Hidrofugal Forte X 30 Ml Eucerin;EUCERIN;25 DE February;25%
;25 DEL MES;10039;Hidrofugal Roll-On X 50 Ml Eucerin;EUCERIN;25 DE February;25%
;25 DEL MES;10047;Dermopure Exfoliante Piel Grasa X 100 Ml Eucerin;EUCERIN;25 DE February;25%
;25 DEL MES;10049;Sun Lotion Textura Muy Ligera Spf 50 X 150 Ml Eucerin;EUCERIN;25 DE February;25%
;25 DEL MES;10050;Sun Crema Gel Antiedad Tono Medio Spf 50 Photoaging X 50Ml Eucerin;EUCERIN;25 DE February;25%
;25 DEL MES;10051;Sun Lotion Kids Spf 50+ X 150 Ml Eucerin;EUCERIN;25 DE February;25%
;25 DEL MES;10052;Higiene Intima Jabon Liquido X 250Ml Eucerin;EUCERIN;25 DE February;25%
;25 DEL MES;10063;Baby Baño Y Shampoo X 240 Ml Eucerin;EUCERIN;25 DE February;25%
;25 DEL MES;10073;Ph5 Locion X 400 Ml Eucerin;EUCERIN;25 DE February;25%
;25 DEL MES;10074;Dermopure Fluido Hidra Matificante X 50 Ml Eucerin;EUCERIN;25 DE February;25%
;25 DEL MES;10075;Urea Repair Plus 10% Locion X 250 Ml Eucerin;EUCERIN;25 DE February;25%
;25 DEL MES;10076;Hyaluron Filler Crema Facial Fps 15 Piel Normal A Mixta X 50 Ml Eucerin;EUCERIN;25 DE February;25%
;25 DEL MES;10095;Da Control Cr Cuidado Intensivo X 40 Gr Eucerin;EUCERIN;25 DE February;25%
;25 DEL MES;10107;Sun Toque Seco Oil Control Spf 50+ X 50 Ml Eucerin;EUCERIN;25 DE February;25%
;25 DEL MES;10108;Sun Fluido Antiedad Spf 50 Photoaging X 50 Ml Eucerin;EUCERIN;25 DE February;25%
;25 DEL MES;10109;Dermopure Oil Control Crema Intensiva De Noche X 40 Ml Eucerin;EUCERIN;25 DE February;25%
;25 DEL MES;10110;Dermopure Oil Control Agua Micelar X 200Ml Eucerin;EUCERIN;25 DE February;25%
;25 DEL MES;10114;Ph5 Crema Intensiva X 450 Ml Eucerin;EUCERIN;25 DE February;25%
;25 DEL MES;10115;Hyaluron Filler+Elasticity Spf 15 Dia X 50 Ml Eucerin;EUCERIN;25 DE February;25%
;25 DEL MES;10116;Hyaluron Filler+Elasticity Noche X 50 Ml Eucerin;EUCERIN;25 DE February;25%
;25 DEL MES;10126;Antipigment Crema Dia Facialx 50Ml Eucerin;EUCERIN;25 DE February;25%
;25 DEL MES;10127;Antipigment Suero Dual X 30Ml Eucerin;EUCERIN;25 DE February;25%
;25 DEL MES;10129;Antipigment Crema Noche X 50Ml Eucerin;EUCERIN;25 DE February;25%
;25 DEL MES;10128;Sun Pigment Control Spf 50 X 50Ml Eucerin;EUCERIN;25 DE February;25%
;25 DEL MES;10130;Hyaluron Filler Elasticity Contorno De Ojos X 15Ml Eucerin;EUCERIN;25 DE February;25%
;25 DEL MES;10131;Hyaluron Filler Hydrating Booster Gel X 30Ml Eucerin;EUCERIN;25 DE February;25%
;25 DEL MES;10138;Hyaluron Mist Spray Facial X 150 Ml Eucerin;EUCERIN;25 DE February;25%
;25 DEL MES;10139;Sun Gel Cream Toque Seco Corporal Spf50+ X 200Ml Eucerin;EUCERIN;25 DE February;25%
;25 DEL MES;10140;Aquaphor Pomada Reparadora Pote X 97 Gr Eucerin;EUCERIN;25 DE February;25%
;25 DEL MES;10142;Aceite De Ducha X 400 Ml Eucerin;EUCERIN;25 DE February;25%
;25 DEL MES;10144;Hyaluron Filler+ Elasticity 3D Serum X 30Ml Eucerin;EUCERIN;25 DE February;25%
;25 DEL MES;10145;Hyaluron Filler Pore Minimizer Serum X 30Ml;EUCERIN;25 DE February;25%
;25 DEL MES;10146;Antipigment Crema De Manos Fps30 X 75 Ml Eucerin;EUCERIN;25 DE February;25%
;25 DEL MES;10147;Aquaphor Reparación De Labios X 10 Ml Eucerin;EUCERIN;25 DE February;25%
;25 DEL MES;10148;Sun Toque Seco Color Tono Medio Spf 50+ X 50Ml Eucerin;EUCERIN;25 DE February;25%
;25 DEL MES;10149;Sun Toque Seco Color Tono Claro Spf 50+ X 50Ml Eucerin;EUCERIN;25 DE February;25%
;25 DEL MES;10150;Ph5 Advance Repair X 450 Ml Eucerin;EUCERIN;25 DE February;25%
;25 DEL MES;10151;Dermopure Oil Control Triple Effect Serum X 40 Ml Eucerin;EUCERIN;25 DE February;25%
;25 DEL MES;10153;Antipigment Ultra Light Serum X 30 Ml Eucerin;EUCERIN;25 DE February;25%
;25 DEL MES;10154;Euc Ph5 Syndent Gel X 400 Eucerin;EUCERIN;25 DE February;25%
;25 DEL MES;10155;Sun Pigment Control Tono Medio Spf 50 X 50Ml Eucerin;EUCERIN;25 DE February;25%
;25 DEL MES;10156;Dermopure Oil Control Gel Limpiador Facial X 400 Ml Eucerin;EUCERIN;25 DE February;25%
;25 DEL MES;10157;Sun Antiedad Tono Claro Spf 50 X 50Ml Eucerin;EUCERIN;25 DE February;25%
;25 DEL MES;10163;Sun Kids Sensitive Protect Toque Seco Spf 50 X 200 Ml Eucerin;EUCERIN;25 DE February;25%
;25 DEL MES;10164;Anti Pigment Contorno De Ojos X 15 Ml Eucerin;EUCERIN;25 DE February;25%
;25 DEL MES;10158;Hyaluron Filler Triple Efecto Gel X 50 Ml Eucerin;EUCERIN;25 DE February;25%
;25 DEL MES;18119;Aquaphor Pomada Reparadora X 49 Gr Eucerin;EUCERIN;25 DE February;25%
;25 DEL MES;10159;Ph5 Light Gel X 200 Ml Eucerin;EUCERIN;25 DE February;25%
;25 DEL MES;10160;Sun Face Hydro Fluid Spf 50+ X 50Ml Eucerin;EUCERIN;25 DE February;25%
;25 DEL MES;10162;Sun Pigment Control Tono Claro Spf 50 X 50Ml Eucerin;EUCERIN;25 DE February;25%
;25 DEL MES;33002;Cs Cleaner Limpiador Suave X 250 Ml Fagron;FAGRON;25 DE February;25%
;25 DEL MES;33003;Fresh Skin Body X 250 Ml Fagron;FAGRON;25 DE February;25%
;25 DEL MES;33004;Fresh Skin Face X 80 Gr Fagron;FAGRON;25 DE February;25%
;25 DEL MES;33006;Neocrin Champu Anticaida C-Graso X 250 Ml Fagron;FAGRON;25 DE February;25%
;25 DEL MES;33007;Neocrin Champu Anticaida C-Normal Seco X 250 Ml Fagron;FAGRON;25 DE February;25%
;25 DEL MES;33008;Sunglas Gel Spf 45 X 80 Gr Fagron;FAGRON;25 DE February;25%
;25 DEL MES;33009;Sunglass Kids Spf 45 X 80 Gr Fagron;FAGRON;25 DE February;25%
;25 DEL MES;33013;Neocrin Tonico Anticaida X 120 Ml;FAGRON;25 DE February;25%
;25 DEL MES;33027;Neocrin Mask X 240 Gr Fagron;FAGRON;25 DE February;25%
;25 DEL MES;33030;Neocrin Champu Anticaspa X 120 Ml Fagron;FAGRON;25 DE February;25%
;25 DEL MES;33041;Cs Cleaner Scrub X 120 Ml Fagron;FAGRON;25 DE February;25%
;25 DEL MES;33042;Cs Cleaner Oil Control X 200 Ml Fagron;FAGRON;25 DE February;25%
;25 DEL MES;33045;Filtroday Spf 50+ X 60 Gr Fagron;FAGRON;25 DE February;25%
;25 DEL MES;33046;Filtroday Color Spf 50 + X 60 G;FAGRON;25 DE February;25%
;25 DEL MES;33063;Neogen Shampo Neo Wash X 250 Ml Fagron;FAGRON;25 DE February;25%
;25 DEL MES;33064;Neogen Acondicionador Neo Cond X 250 Ml Fagron;FAGRON;25 DE February;25%
;25 DEL MES;33065;Neogen Serum Neo Serum X 150 Ml Fagron;FAGRON;25 DE February;25%
;25 DEL MES;33067;Neogen Tratamiento Intensivo Neo Serum X 40 Ml;FAGRON;25 DE February;25%
;25 DEL MES;33068;Urea 15% Ultrahidratante X 60 Gr;FAGRON;25 DE February;25%
;25 DEL MES;33069;Fresh Skin Ultra X 150 Gr Fagron;FAGRON;25 DE February;25%
;25 DEL MES;33070;Neogen Restaurador De Cejas Y Pestañas X 4 Ml;FAGRON;25 DE February;25%
;25 DEL MES;33072;Juvynit Ojos Prevention X 15 Ml Fagron;FAGRON;25 DE February;25%
;25 DEL MES;33073;Juvynit Prevention Serum X 30 Ml Fagron;FAGRON;25 DE February;25%
;25 DEL MES;33074;Juvynit Renew Serum X 30 Ml Fagron;FAGRON;25 DE February;25%
;25 DEL MES;33075;Juvynit Renew Day Spf 15 X 50 Ml Fagron;FAGRON;25 DE February;25%
;25 DEL MES;33077;Juvynit Prevention Moisturizing Spf 15 X 50 Ml Fagron;FAGRON;25 DE February;25%
;25 DEL MES;33078;Sunglass Oil Control X 50 Ml Fagron;FAGRON;25 DE February;25%
;25 DEL MES;33079;Sunglass Spf 50+ Antiedad Toque Seco X 50 Ml Fagron;FAGRON;25 DE February;25%
