PROMOCION;MES;SKU ;PRODUCTO;LABORATORIO;FECHA;DESCUENTO
;25 DEL MES;120002;Meik Compacto Tono Medio Spf 15 *13G;NOVUM COMERCIALIZADORA S.A.S;25 DE February;25%
;25 DEL MES;120003;Meik Compacto Tono Oscuro Spf 15 *13G;NOVUM COMERCIALIZADORA S.A.S;25 DE February;25%
;25 DEL MES;120004;Meik Agua Micelar*240 Ml;NOVUM COMERCIALIZADORA S.A.S;25 DE February;25%
;25 DEL MES;120008;Meik Protector Labial Spf 30 X 3.8 Gr;NOVUM COMERCIALIZADORA S.A.S;25 DE February;25%
;25 DEL MES;120009;Meik Pestañina Waterproof Negra X 9 Gr;NOVUM COMERCIALIZADORA S.A.S;25 DE February;25%
;25 DEL MES;22229;Sensilis Hydra Essence Confort Mask X 150Ml;SENSILIS;25 DE February;25%
;25 DEL MES;22230;Sensilis Hydra Essence Gel Sorbete X 40Ml;SENSILIS;25 DE February;25%
;25 DEL MES;22231;Sensilis Skin Delight Illuminating & Antioxidant Mask X 150Ml;SENSILIS;25 DE February;25%
;25 DEL MES;22232;Sensilis Ritual Care Comfort Cleansing Mousse X 200Ml;SENSILIS;25 DE February;25%
;25 DEL MES;22233;Sensilis Ritual Care Hydro-Nourishing Toner X 200Ml;SENSILIS;25 DE February;25%
;25 DEL MES;22234;Sensilis Agua Micellar AR X 400Ml;SENSILIS;25 DE February;25%
;25 DEL MES;22235;Sensilis Upgrade Fluido Reafirmante X 50Ml;SENSILIS;25 DE February;25%
;25 DEL MES;22236;Sensilis Upgrade Gel Serum Reafirmante Concentrado X 30Ml;SENSILIS;25 DE February;25%
;25 DEL MES;22237;Sensilis Upgrade Ar Crema Sorbete Reafirmante Calmante X 50Ml;SENSILIS;25 DE February;25%
;25 DEL MES;22238;Sensilis Upgrade Crema Noche Tratamiento Reafirmante X 50Ml;SENSILIS;25 DE February;25%
;25 DEL MES;22239;Sensilis Upgrade Ojos Tratamiento Restaurador X 15Ml;SENSILIS;25 DE February;25%
;25 DEL MES;22248;Sensilis Upgrade Base De Maquillaje Miel Rosa Tono 2 X 30Ml;SENSILIS;25 DE February;25%
;25 DEL MES;22249;Sensilis Upgrade Base De Maquillaje Beige Tono 1 X 30 Ml;SENSILIS;25 DE February;25%
;25 DEL MES;22250;Sensilis Upgrade Base De Maquillaje Miel Doree Tono 3 X 30Ml;SENSILIS;25 DE February;25%
;25 DEL MES;22251;Sensilis Supreme Booster Sérum X 30Ml;SENSILIS;25 DE February;25%
;25 DEL MES;22252;Sensilis Supreme Contorno De Ojos Detox X 20Ml;SENSILIS;25 DE February;25%
;25 DEL MES;22253;Sensilis Supreme Crema De Dia Renovadora Spf15 X 50 Ml;SENSILIS;25 DE February;25%
;25 DEL MES;22254;Sensilis Supreme Crema De Noche Reparadora X 50 Ml;SENSILIS;25 DE February;25%
;25 DEL MES;22297;Sensilis Eternalist A.G.E Serum X 30 Ml;SENSILIS;25 DE February;25%
;25 DEL MES;22298;Sensilis Eternalist A.G.E Ojos X 20Gr;SENSILIS;25 DE February;25%
;25 DEL MES;22299;Sensilis Calm In Balm X 50Ml;SENSILIS;25 DE February;25%
;25 DEL MES;22328;Sensilis Photocorrection (D-Pigmen 50+) Color X 40Ml;SENSILIS;25 DE February;25%
;25 DEL MES;22329;Sensilis Skin D-Pigment Overnight X 30 Ml;SENSILIS;25 DE February;25%
;25 DEL MES;22330;Sensilis Skin D-Pigment Serum X 30 Ml;SENSILIS;25 DE February;25%
;SAN VALENTIN;65131;Fotoprotector Gel Crema Pediatrics Spf 50 X 250 Ml Isdin;ISDIN COLOMBIA S.A.S.;25 DE February;25%
;SAN VALENTIN;65132;Fotoprotector Fusion Water Magic X 50Ml Isdin;ISDIN COLOMBIA S.A.S.;25 DE February;25%
;SAN VALENTIN;65003;Fotoprotector Gel Crema Spf 50 X 250 Ml Isdin;ISDIN COLOMBIA S.A.S.;25 DE February;25%
;SAN VALENTIN;65007;Ureadin Ultra 10 Plus Locion X 200Ml Isdin;ISDIN COLOMBIA S.A.S.;25 DE February;25%
;SAN VALENTIN;65008;Ureadin Ultra 20 Crema X 100Ml Isdin;ISDIN COLOMBIA S.A.S.;25 DE February;25%
;SAN VALENTIN;65009;Ureadin Ultra 30 Crema Emoliente X 50 Ml Isdin;ISDIN COLOMBIA S.A.S.;25 DE February;25%
;SAN VALENTIN;65010;Ureadin Ultra 40 Gel Exfoliante X 30 Ml Isdin;ISDIN COLOMBIA S.A.S.;25 DE February;25%
;SAN VALENTIN;65012;Fotoprotector Fusion Fluid 50+ X 50 Ml Isdin;ISDIN COLOMBIA S.A.S.;25 DE February;25%
;SAN VALENTIN;65013;Fotoprotector Fusion Fluid Color Spf 50+ X 50 Ml Isdin;ISDIN COLOMBIA S.A.S.;25 DE February;25%
;SAN VALENTIN;65015;Ureadin Podos Gel Oil X 75 Ml Isdin;ISDIN COLOMBIA S.A.S.;25 DE February;25%
;SAN VALENTIN;65017;Ureadin Ultra 10 Plus Locion X 400Ml Isdin;ISDIN COLOMBIA S.A.S.;25 DE February;25%
;SAN VALENTIN;65018;Ureadin Bath Gel X 400 Ml Isdin;ISDIN COLOMBIA S.A.S.;25 DE February;25%
;SAN VALENTIN;65019;Eryfotona Fluido Spf 99 X 50 Ml Isdin;ISDIN COLOMBIA S.A.S.;25 DE February;25%
;SAN VALENTIN;65020;Fotoultra 100 Active Unify Fusion Fluid X 50 Ml Isdin;ISDIN COLOMBIA S.A.S.;25 DE February;25%
;SAN VALENTIN;65021;Fotoultra 100 Spot Prevent Fusion Fluid X 50 Ml Isdin;ISDIN COLOMBIA S.A.S.;25 DE February;25%
;SAN VALENTIN;65022;Fotoultra Age Repair Fluid Spf 50+X 50 Ml Isdin;ISDIN COLOMBIA S.A.S.;25 DE February;25%
;SAN VALENTIN;65024;Fotoprotector Hydro Oil Spf30 X 200Ml Isdin;ISDIN COLOMBIA S.A.S.;25 DE February;25%
;SAN VALENTIN;65026;Fotoprotector Oil Control Fusion Water X 50Ml Isdin;ISDIN COLOMBIA S.A.S.;25 DE February;25%
;SAN VALENTIN;65027;Nutratopic Pro-Amp Gel De Baño X 400 Ml Isdin;ISDIN COLOMBIA S.A.S.;25 DE February;25%
;SAN VALENTIN;65028;Nutratopic Pro-Amp Locion Emoliente X 400Ml Isdin;ISDIN COLOMBIA S.A.S.;25 DE February;25%
;SAN VALENTIN;65029;Nutratopic Pro-Amp Crema Facial X 50Ml Isdin;ISDIN COLOMBIA S.A.S.;25 DE February;25%
;SAN VALENTIN;65030;Fotoultra 100 (Color) Active Unify Fusion Fluid X 50 Ml Isdin;ISDIN COLOMBIA S.A.S.;25 DE February;25%
;SAN VALENTIN;65031;Nutratopic Pro-Amp Crema Emoliente X 204 Gr Isdin;ISDIN COLOMBIA S.A.S.;25 DE February;25%
;SAN VALENTIN;65033;Isdinceutics Flavo C Serum X 30 Ml Isdin;ISDIN COLOMBIA S.A.S.;25 DE February;25%
;SAN VALENTIN;65034;Isdinceutics Age Reverse Day X 51.5Gr Isdin;ISDIN COLOMBIA S.A.S.;25 DE February;25%
;SAN VALENTIN;65035;K-OX Eyes X 15 Gr Isdin;ISDIN COLOMBIA S.A.S.;25 DE February;25%
;SAN VALENTIN;65036;Flavo C Ultraglican X 30 Ampollas X 2 Ml Isdin;ISDIN COLOMBIA S.A.S.;25 DE February;25%
;SAN VALENTIN;65039;Fotoprotector Hydro Lotion Spf 50+ X 200 Ml Isdin;ISDIN COLOMBIA S.A.S.;25 DE February;25%
;SAN VALENTIN;65041;Solucion Micellar X 400 Ml Isdin;ISDIN COLOMBIA S.A.S.;25 DE February;25%
;SAN VALENTIN;65042;Skin Drops Bronze X 15 Ml Isdin;ISDIN COLOMBIA S.A.S.;25 DE February;25%
;SAN VALENTIN;65043;Skin Drops Sand X 15 Ml Isdin;ISDIN COLOMBIA S.A.S.;25 DE February;25%
;SAN VALENTIN;65044;Flavo C Melatonin Noche X 10 Ampollas 2 Ml Caja Negra;ISDIN COLOMBIA S.A.S.;25 DE February;25%
;SAN VALENTIN;65045;Fotoprotector Oil Control Fusion Water Color Medium X 50 Ml Isdin;ISDIN COLOMBIA S.A.S.;25 DE February;25%
;SAN VALENTIN;65046;Flavo C Melatonin Ultraglican Dia Y Noche X 10+10 Ampollas 2 Ml Isdin;ISDIN COLOMBIA S.A.S.;25 DE February;25%
;SAN VALENTIN;65047;Flavo C Pack Rutina (Dia+Noche+Agua Micellare);ISDIN COLOMBIA S.A.S.;25 DE February;25%
;SAN VALENTIN;65049;Fotoultra Age Repair Fluid Regalo Git Flavo C Melatonin;ISDIN COLOMBIA S.A.S.;25 DE February;25%
;SAN VALENTIN;65050;Solucion Micellar X 100 Ml Isdin;ISDIN COLOMBIA S.A.S.;25 DE February;25%
;SAN VALENTIN;65051;Instan Flash X1 Ampolla Isdin;ISDIN COLOMBIA S.A.S.;25 DE February;25%
;SAN VALENTIN;65052;Instant Flash X5 Ampollas Isdin;ISDIN COLOMBIA S.A.S.;25 DE February;25%
;SAN VALENTIN;65053;Fotoprotector Pediatrico Fusion Water Spf 50 X 50 Ml Isdin;ISDIN COLOMBIA S.A.S.;25 DE February;25%
;SAN VALENTIN;65054;Pigment Expert Night Pell Día X 10 Y Noche X 10 Isdin;ISDIN COLOMBIA S.A.S.;25 DE February;25%
;SAN VALENTIN;65055;Nutradeica Ds Gel Crema Facial X 50 Ml Isdin;ISDIN COLOMBIA S.A.S.;25 DE February;25%
;SAN VALENTIN;65056;Protector Labial Spf 50+ X 4 Gr Isdin;ISDIN COLOMBIA S.A.S.;25 DE February;25%
;SAN VALENTIN;65057;Protector Labial Spf 30+ X 4 Gr Isdin;ISDIN COLOMBIA S.A.S.;25 DE February;25%
;SAN VALENTIN;65058;Reparador Labial Con Acido Hialuronico X 4 Gr Isdin;ISDIN COLOMBIA S.A.S.;25 DE February;25%
;SAN VALENTIN;65059;Protector Labial Hv Spf 30 X 4 Gr Isdin;ISDIN COLOMBIA S.A.S.;25 DE February;25%
;SAN VALENTIN;65060;Fotoprotector Fusion Fluid Mineral Spf 50 X 50 Ml Isdin;ISDIN COLOMBIA S.A.S.;25 DE February;25%
;SAN VALENTIN;65062;Fotoprotector Compacto Spf 50+ Arena Isdin;ISDIN COLOMBIA S.A.S.;25 DE February;25%
;SAN VALENTIN;65063;Fotoprotector Compacto Spf 50+ Bronce Isdin;ISDIN COLOMBIA S.A.S.;25 DE February;25%
;SAN VALENTIN;65064;Si-Nails X 2.5 Ml Isdin;ISDIN COLOMBIA S.A.S.;25 DE February;25%
;SAN VALENTIN;65071;Gel Higienizante De Manos Aloe Vera X 120Ml Germisdin;ISDIN COLOMBIA S.A.S.;25 DE February;25%
;SAN VALENTIN;65072;Gel De Baño Original X 500Ml Germisdin;ISDIN COLOMBIA S.A.S.;25 DE February;25%
;SAN VALENTIN;65073;Hyaluronic Booster 5 Amp X 2Ml Isdin;ISDIN COLOMBIA S.A.S.;25 DE February;25%
;SAN VALENTIN;65074;Isdinceutics Age Reverse Night X 50Ml Isdin;ISDIN COLOMBIA S.A.S.;25 DE February;25%
;SAN VALENTIN;65075;Hyaluronic Booster 30 Amp X 2Ml Isdin;ISDIN COLOMBIA S.A.S.;25 DE February;25%
;SAN VALENTIN;65076;Fotoprotector Pediatrics Spray Wet Skin Spf 50+ X 50 Ml Isdin;ISDIN COLOMBIA S.A.S.;25 DE February;25%
;SAN VALENTIN;65077;Pack Instant Flash X 5 Amp+ Solucion Micelar X 100Ml+ Mini Vital Eyes;ISDIN COLOMBIA S.A.S.;25 DE February;25%
;SAN VALENTIN;65081;Fotoprotector Urban Fusion Water Spf 30 X 50Ml Isdin;ISDIN COLOMBIA S.A.S.;25 DE February;25%
;SAN VALENTIN;65082;Ureadin Crema De Manos Plus Q10 Repair X 50Ml Isdin;ISDIN COLOMBIA S.A.S.;25 DE February;25%
;SAN VALENTIN;65083;Flavo-C Melatonin Ultraligera 30 Amp X 2Ml Isdin;ISDIN COLOMBIA S.A.S.;25 DE February;25%
;SAN VALENTIN;65085;Shampoo Scaly Skin Alsora Control X 200Ml Isdin;ISDIN COLOMBIA S.A.S.;25 DE February;25%
;SAN VALENTIN;65086;Shampoo Ultra Suave Daylisdin X 400Ml Isdin;ISDIN COLOMBIA S.A.S.;25 DE February;25%
;SAN VALENTIN;65087;Shampoo Anticaída Lambdapil X 200Ml Isdin;ISDIN COLOMBIA S.A.S.;25 DE February;25%
;SAN VALENTIN;65088;Shampoo Anticaspa Grasa Nutradeica X 200Ml Isdin;ISDIN COLOMBIA S.A.S.;25 DE February;25%
;SAN VALENTIN;65089;Lambdapil Loción Capilar X 125Ml Isdin;ISDIN COLOMBIA S.A.S.;25 DE February;25%
;SAN VALENTIN;65090;Vital Eyes X 15 Gr Isdin;ISDIN COLOMBIA S.A.S.;25 DE February;25%
;SAN VALENTIN;65094;Hyaluronic Concetrate X 30 Ml Isdin;ISDIN COLOMBIA S.A.S.;25 DE February;25%
;SAN VALENTIN;65095;Fotoultra Age Repair Color Spf 50+ X 50 Ml;ISDIN COLOMBIA S.A.S.;25 DE February;25%
;SAN VALENTIN;65096;Fotoprotector Fusion Gel Sport Spf 50+ X 100 Ml Isdin;ISDIN COLOMBIA S.A.S.;25 DE February;25%
;SAN VALENTIN;65101;Glicoisdin 8 Soft Crema X 50 Gr Isdin;ISDIN COLOMBIA S.A.S.;25 DE February;25%
;SAN VALENTIN;65102;Glicoisdin 15 Moderate Crema X 50 Gr Isdin;ISDIN COLOMBIA S.A.S.;25 DE February;25%
;SAN VALENTIN;65103;Glicoisdin 10 Soft Gel X 50 Gr Isdin;ISDIN COLOMBIA S.A.S.;25 DE February;25%
;SAN VALENTIN;65104;Glicoisdin 15 Moderate Gel X 50 Gr Isdin;ISDIN COLOMBIA S.A.S.;25 DE February;25%
;SAN VALENTIN;65105;Glicoisdin 25 Intense Gel X 50 Gr Isdin;ISDIN COLOMBIA S.A.S.;25 DE February;25%
;SAN VALENTIN;65106;Fotoprotector Uv Mineral Sun Brush Spf 50+ X 2 Gr Isdin;ISDIN COLOMBIA S.A.S.;25 DE February;25%
;SAN VALENTIN;65110;Isdinceutics Flavo C Forte 3 Frascos X 5.3 Ml Isdin;ISDIN COLOMBIA S.A.S.;25 DE February;25%
;SAN VALENTIN;65111;Fotoprotector Oil Control Fusion Water Color Light X 50 Ml Isdin;ISDIN COLOMBIA S.A.S.;25 DE February;25%
;SAN VALENTIN;65112;Fotoprotector Oil Control Fusion Water Color Bronze X 50Ml Isdin;ISDIN COLOMBIA S.A.S.;25 DE February;25%
;SAN VALENTIN;65113;Isdinceutics Flavo C Forte 1 Frasco X 5.3 Ml Isdin;ISDIN COLOMBIA S.A.S.;25 DE February;25%
;SAN VALENTIN;65115;Isdinceutics Essential Cleansing X 200 Ml Isdin;ISDIN COLOMBIA S.A.S.;25 DE February;25%
;SAN VALENTIN;65117;Woman Crema Antiestrias X 250 Ml Isdin;ISDIN COLOMBIA S.A.S.;25 DE February;25%
;SAN VALENTIN;65118;Woman Crema Reafirmante X 200 Ml Isdin;ISDIN COLOMBIA S.A.S.;25 DE February;25%
;SAN VALENTIN;65120;Teen Skin Acniben Body Spray X 150 ML ISdin;ISDIN COLOMBIA S.A.S.;25 DE February;25%
;SAN VALENTIN;65122;Fotoprotector Spray Wet Skin Spf 50 + X 250 Ml Isdin;ISDIN COLOMBIA S.A.S.;25 DE February;25%
;SAN VALENTIN;65124;Isdinceutics Retinal Intense X 50 Ml Isdin;ISDIN COLOMBIA S.A.S.;25 DE February;25%
;SAN VALENTIN;65126;Reparador Labial Fluido Con Acido Hialuronico X 10 ML Isdin;ISDIN COLOMBIA S.A.S.;25 DE February;25%
;SAN VALENTIN;65127;Ureadin 10 Locion X 1000 Ml Isdin;ISDIN COLOMBIA S.A.S.;25 DE February;25%
;SAN VALENTIN;74011;Capri Syndet Ducha X 500 Ml;ISDIN COLOMBIA S.A.S.;25 DE February;25%
;SAN VALENTIN;65124;Isdinceutics Retinal Intense X 50 Ml Isdin;ISDIN COLOMBIA S.A.S.;25 DE February;25%
;SAN VALENTIN;26037;Agua Thermal X 150 Ml Avene;AVENE;25 DE February;25%
;SAN VALENTIN;26038;Agua Thermal X 300 Ml Avene;AVENE;25 DE February;25%
;SAN VALENTIN;26287;Agua Thermal X 50 Ml Avene;AVENE;25 DE February;25%
;SAN VALENTIN;26039;Akerat Crema Corporal X 200 Ml Avene;AVENE;25 DE February;25%
;SAN VALENTIN;26575;A-Oxitive Aqua Crema De Dia Y Noche X 30 Ml Avene;AVENE;25 DE February;25%
;SAN VALENTIN;26640;A-Oxitive Contorno De Ojos X 15 Ml Avene;AVENE;25 DE February;25%
;SAN VALENTIN;26641;A-Oxitive Noche Peeling X 30 Ml Avene;AVENE;25 DE February;25%
;SAN VALENTIN;26576;A-Oxitive Suero X 30 Ml Avene;AVENE;25 DE February;25%
;SAN VALENTIN;26655;Avene Solar Antiedad Con Color Spf 50+ 50 Ml;AVENE;25 DE February;25%
;SAN VALENTIN;26525;Avene Solar Antiedad Emulsion Spf50+ X 50 Ml;AVENE;25 DE February;25%
;SAN VALENTIN;26577;Avene Solar Cleanance 50+ X 50 Ml;AVENE;25 DE February;25%
;SAN VALENTIN;26669;Avene Solar Cleanance Color Spf 50+ X 50 Ml;AVENE;25 DE February;25%
;SAN VALENTIN;26372;Avene Solar Compacto Arena Spf 50 X 10 Gr;AVENE;25 DE February;25%
;SAN VALENTIN;26074;Avene Solar Compacto Dore Spf 50 X 10 Gr;AVENE;25 DE February;25%
;SAN VALENTIN;26578;Avene Solar Crema Color 50+X 50 Ml;AVENE;25 DE February;25%
;SAN VALENTIN;26077;Avene Solar Crema Pantallas Fisicas Spf 50 X 50 Ml;AVENE;25 DE February;25%
;SAN VALENTIN;26076;Avene Solar Crema Spf 50 + X 50 Ml;AVENE;25 DE February;25%
;SAN VALENTIN;26536;Avene Solar Fluido Mineral Spf 50+ Sin Color X 40 Ml (Línea Blanca);AVENE;25 DE February;25%
;SAN VALENTIN;26518;Avene Solar Fluido Mineral Tinte 50+ X 40 Ml;AVENE;25 DE February;25%
;SAN VALENTIN;26656;Avene Solar Fluido Sport 50+ 100 Ml;AVENE;25 DE February;25%
;SAN VALENTIN;26541;Avene Solar Fluido Tinte Spf 50+ X 50 Ml;AVENE;25 DE February;25%
;SAN VALENTIN;26704;Avene Solar Intense Protect Spf 50+ X 150 Ml;AVENE;25 DE February;25%
;SAN VALENTIN;26078;Avene Solar Leche Spf 50+ X 100 Ml;AVENE;25 DE February;25%
;SAN VALENTIN;26211;Avene Solar Leche Pantalla 50+ X 100 Ml;AVENE;25 DE February;25%
;SAN VALENTIN;26420;Avene Solar Leche Spf 50+ Niños X 100 Ml;AVENE;25 DE February;25%
;SAN VALENTIN;26579;Avene Solar Ln Fluido Spf 50+ X 50 Ml Avene;AVENE;25 DE February;25%
;SAN VALENTIN;26574;Avene Solar Mat Perfect Color Fluido Spf 50+ X 50 Ml;AVENE;25 DE February;25%
;SAN VALENTIN;26111;Avene Solar Spray 50+ X 200 Ml;AVENE;25 DE February;25%
;SAN VALENTIN;26079;Avene Solar Spray Spf 50 Niños X 200 Ml;AVENE;25 DE February;25%
;SAN VALENTIN;26573;Avene Solar Ultramat Fluido 50+ X 50 Ml;AVENE;25 DE February;25%
;SAN VALENTIN;26623;Cicalfate Balsamo Labios X 10 Ml Avene;AVENE;25 DE February;25%
;SAN VALENTIN;26625;Cicalfate Crema De Manos X 100 Ml Avene;AVENE;25 DE February;25%
;SAN VALENTIN;26238;Cicalfate Locion X 40 Ml Avene;AVENE;25 DE February;25%
;SAN VALENTIN;26671;Cicalfate Plus Crema X 100 Ml Avene;AVENE;25 DE February;25%
;SAN VALENTIN;26667;Cicalfate Plus Crema X 40 Ml Avene;AVENE;25 DE February;25%
;SAN VALENTIN;26670;Cicalfate Plus Spray X 100 Ml;AVENE;25 DE February;25%
;SAN VALENTIN;26418;Cleanance Barra X 100 Gr Avene;AVENE;25 DE February;25%
;SAN VALENTIN;26699;Cleanance Comedomed Sos X 15 Ml Avene;AVENE;25 DE February;25%
;SAN VALENTIN;26658;Cleanance Comedomed X 30 Ml Avene;AVENE;25 DE February;25%
;SAN VALENTIN;26675;Cleanance Emulsion Matificante Cuidado Dia X 40Ml Avene;AVENE;25 DE February;25%
;SAN VALENTIN;26045;Cleanance Emulsion Matificante X 40 Ml Avene;AVENE;25 DE February;25%
;SAN VALENTIN;26460;Cleanance Expert X 40Ml Avene;AVENE;25 DE February;25%
;SAN VALENTIN;26583;Cleanance Expert Color X 40Ml Avene;AVENE;25 DE February;25%
;SAN VALENTIN;26622;Cleanance Gel Lim 400Ml Avene;AVENE;25 DE February;25%
;SAN VALENTIN;26046;Cleanance Gel Limpiador 200 Ml Avene;AVENE;25 DE February;25%
;SAN VALENTIN;26458;Cleanance Hydra (Crema Calmante) X 40Ml Avene;AVENE;25 DE February;25%
;SAN VALENTIN;26491;Cleanance Locion Micelar X 100Ml Avene;AVENE;25 DE February;25%
;SAN VALENTIN;26674;Cleanance Woman Noche Lissant X 30 Ml Avene;AVENE;25 DE February;25%
;SAN VALENTIN;26047;Crema Nutritiva Compensadora X 50 Ml Avene;AVENE;25 DE February;25%
;SAN VALENTIN;26389;Crema Pieles Intolerantes Defi X 50 Ml Avene;AVENE;25 DE February;25%
;SAN VALENTIN;26327;D Pigment Legere X 30 Ml Avene;AVENE;25 DE February;25%
;SAN VALENTIN;26614;Dermabsolu Contorno De Ojos X 15 Ml Avene;AVENE;25 DE February;25%
;SAN VALENTIN;26613;Dermabsolu Crema De Dia X 40 Ml Avene;AVENE;25 DE February;25%
;SAN VALENTIN;26611;Dermabsolu Noche X 40 Ml Avene;AVENE;25 DE February;25%
;SAN VALENTIN;26612;Dermabsolu Serum X 30 Ml Avene;AVENE;25 DE February;25%
;SAN VALENTIN;26059;Espuma De Afeitar X 200 Ml Avene;AVENE;25 DE February;25%
;SAN VALENTIN;26400;Espuma Limpiadora Mousse Nettoyante X 150 Ml Avene;AVENE;25 DE February;25%
;SAN VALENTIN;26619;Fluido Mineral Sin Color Avene;AVENE;25 DE February;25%
;SAN VALENTIN;26056;Hidratante Legere X 40 Ml Avene;AVENE;25 DE February;25%
;SAN VALENTIN;26654;Hydrance Aqua-Gel Crema Hidratante X 50 Ml Avene;AVENE;25 DE February;25%
;SAN VALENTIN;26652;Hydrance Crema Hidratante Uv Riche Spf30 X 40 Ml Avene;AVENE;25 DE February;25%
;SAN VALENTIN;26651;Hydrance Hidratante Uv Legere Spf 30 X 40 Ml Avene;AVENE;25 DE February;25%
;SAN VALENTIN;26417;Hydrance Optimale Intense Serum X 30 Ml Avene;AVENE;25 DE February;25%
;SAN VALENTIN;26102;Leche Desmaquillante X 200 Ml Avene;AVENE;25 DE February;25%
;SAN VALENTIN;26679;Locion Micelar Cleanance X 400 Ml Avene;AVENE;25 DE February;25%
;SAN VALENTIN;26237;Locion Micelar X 200 Ml Avene;AVENE;25 DE February;25%
;SAN VALENTIN;26402;Locion Micelar X 400Ml Avene;AVENE;25 DE February;25%
;SAN VALENTIN;26161;Locion Pieles Intolerantes X 200Ml Avene;AVENE;25 DE February;25%
;SAN VALENTIN;26637;Locion Tonica X 200 Ml Avene;AVENE;25 DE February;25%
;SAN VALENTIN;26471;Physiolift Balsamo Noche X 30 Ml Avene;AVENE;25 DE February;25%
;SAN VALENTIN;26474;Physiolift Crema Dia X 30 Ml Avene;AVENE;25 DE February;25%
;SAN VALENTIN;26472;Physiolift Emulsion Dia X 30Ml Avene;AVENE;25 DE February;25%
;SAN VALENTIN;26475;Physiolift Ojos X 15 Ml Avene;AVENE;25 DE February;25%
;SAN VALENTIN;26665;Physiolift Ojos X 15Ml + Agua Thermal X 300Ml Avene;AVENE;25 DE February;25%
;SAN VALENTIN;26473;Physiolift Precision X 15Ml Avene;AVENE;25 DE February;25%
;SAN VALENTIN;26638;Physiolift Serum X 30 Ml Avene;AVENE;25 DE February;25%
;SAN VALENTIN;26636;Soin Contorno De Ojos X 15 Ml Cuidado Desfatigante Avene;AVENE;25 DE February;25%
;SAN VALENTIN;26697;Tolerancia Control Crema X 40 Ml Avene;AVENE;25 DE February;25%
;SAN VALENTIN;26220;Tolerancia Extrema Crema X 50Ml Avene;AVENE;25 DE February;25%
;SAN VALENTIN;26696;Tolerancia Locion Limpiadora X 200 Ml Avene;AVENE;25 DE February;25%
;SAN VALENTIN;26526;Triacneal Expert X 30Ml Avene;AVENE;25 DE February;25%
;SAN VALENTIN;26628;Trixera Barra Lampiadora 100 Gr Avene;AVENE;25 DE February;25%
;SAN VALENTIN;26527;Trixera Lait Nutri-Fluido X 200Ml Avene;AVENE;25 DE February;25%
;SAN VALENTIN;26401;Xeracalm A.D Aceite Limpiador X 400Ml Avene;AVENE;25 DE February;25%
;SAN VALENTIN;26398;Xeracalm A.D Baume Defi X 200Ml Avene;AVENE;25 DE February;25%
;SAN VALENTIN;26716;Gel Micelar Desmaquillante X 200 Ml Avene;AVENE;25 DE February;25%
;SAN VALENTIN;26719;Crema De Noche Multi-Intensiva Hyaluron Activ B3 X 40 Ml Avene;AVENE;25 DE February;25%
;SAN VALENTIN;26720;Crema De Dia Hyaluron Activ B3 X 50 Ml Avene;AVENE;25 DE February;25%
;SAN VALENTIN;26721;Repuesto Crema De Dia Hyaluron Activ B3 X 50 Ml Avene;AVENE;25 DE February;25%
;SAN VALENTIN;26722;Serum Concentrado Voluminizador Hyaluron Activ B3 X 30 Ml Avene;AVENE;25 DE February;25%
;SAN VALENTIN;26399;Xeracalm A.D Crema Defi X 200 Ml Avene;AVENE;25 DE February;25%
;SAN VALENTIN;26662;Xeracalm Ad Concentrada Calmante X 50 Ml Avene;AVENE;25 DE February;25%
;SAN VALENTIN;26724;Extra Doux Shampoo Dermoprotector X 400 Ml Ducray;AVENE;25 DE February;25%
;SAN VALENTIN;26221;Anacaps X 60 Caps Ducray;DUCRAY;25 DE February;25%
;SAN VALENTIN;26510;Anaphase Acondicionador Ducray X 200 Ml Ducray;DUCRAY;25 DE February;25%
;SAN VALENTIN;26258;Anaphase Shampu X 200 Ml Ducray;DUCRAY;25 DE February;25%
;SAN VALENTIN;26629;Anaphase Shampu X 400 Ml Ducray;DUCRAY;25 DE February;25%
;SAN VALENTIN;26403;Creastim Locion Anticaida X 2 X 30 Ml Ducray;DUCRAY;25 DE February;25%
;SAN VALENTIN;26090;Elucion Champu X 200 Ml Ducray;DUCRAY;25 DE February;25%
;SAN VALENTIN;26364;Kelual Ds Crema Queratorreductora X 40 Ml Ducray;DUCRAY;25 DE February;25%
;SAN VALENTIN;26093;Kelual Ds Shampo X 100 Ml Ducray;DUCRAY;25 DE February;25%
;SAN VALENTIN;26540;Keracnyl Control Crema 30 Ml Ducray;DUCRAY;25 DE February;25%
;SAN VALENTIN;26630;Keracnyl Gel 400 Ml Ducray;DUCRAY;25 DE February;25%
;SAN VALENTIN;26534;Keracnyl Gel X 200 Ml Ducray;DUCRAY;25 DE February;25%
;SAN VALENTIN;26698;Keracnyl Glycolic+ X 30Ml Ducray;DUCRAY;25 DE February;25%
;SAN VALENTIN;26535;Keracnyl Pp X 30 Ml Ducray;DUCRAY;25 DE February;25%
;SAN VALENTIN;26659;Kertyol Pso Shampoo Reequilibrante X 200 Ml;DUCRAY;25 DE February;25%
;SAN VALENTIN;26501;Melascreen Crema De Noche X 50Ml Ducray;DUCRAY;25 DE February;25%
;SAN VALENTIN;26178;Melascreen Despigmentante X 30Ml Ducray;DUCRAY;25 DE February;25%
;SAN VALENTIN;26189;Melascreen Iluminador Spf 15 X 40Ml Ducray;DUCRAY;25 DE February;25%
;SAN VALENTIN;26502;Melascreen Riche Spf 50 X 40Ml Ducray;DUCRAY;25 DE February;25%
;SAN VALENTIN;26500;Melascreen Suero Global X 30Ml Ducray;DUCRAY;25 DE February;25%
;SAN VALENTIN;26533;Melascreen Uv Tacto Seco Spf 50 Crema Ligera X 40Ml Ducray;DUCRAY;25 DE February;25%
;SAN VALENTIN;26490;Neoptide Hombre Loción X 100Ml Ducray;DUCRAY;25 DE February;25%
;SAN VALENTIN;26222;Neoptide Locion X 3 C/U 30Ml Ducray;DUCRAY;25 DE February;25%
;SAN VALENTIN;26281;Nutricerat Shampoo X 200 Ducray;DUCRAY;25 DE February;25%
;SAN VALENTIN;26096;Sabal Champu X 200 Ml Ducray;DUCRAY;25 DE February;25%
;SAN VALENTIN;26363;Sensinol Champu Tratante X 200Ml Ducray;DUCRAY;25 DE February;25%
;SAN VALENTIN;26714;Creastim Loción Reactiv X 60 Ml Ducray;DUCRAY;25 DE February;25%
;SAN VALENTIN;26715;Keracnyl Serum X 30 Ml Ducray;DUCRAY;25 DE February;25%
;SAN VALENTIN;26723;Neoptide Expert Ducray X 50 Ml;DUCRAY;25 DE February;25%
;;;;;;
;;;;;;
;;;;;;
;;;;;;
;;;;;;
;;;;;;
;;;;;;
;;;;;;
;;;;;;
;;;;;;
;;;;;;
;;;;;;
;;;;;;
;;;;;;
;;;;;;
;;;;;;
;;;;;;
;;;;;;
;;;;;;
;;;;;;
;;;;;;
;;;;;;
;;;;;;
;;;;;;
;;;;;;
;;;;;;
;;;;;;
;;;;;;
;;;;;;
;;;;;;
;;;;;;
;;;;;;
;;;;;;
;;;;;;
;;;;;;
;;;;;;
;;;;;;
;;;;;;
;;;;;;
;;;;;;
;;;;;;
;;;;;;
;;;;;;
;;;;;;
;;;;;;
;;;;;;
;;;;;;
;;;;;;
;;;;;;
;;;;;;
;;;;;;
;;;;;;
;;;;;;
;;;;;;
;;;;;;
;;;;;;
;;;;;;
;;;;;;
;;;;;;
;;;;;;
;;;;;;
;;;;;;
;;;;;;
;;;;;;
;;;;;;
;;;;;;
;;;;;;
;;;;;;
;;;;;;
;;;;;;
;;;;;;
;;;;;;
;;;;;;
;;;;;;
;;;;;;
;;;;;;
;;;;;;
;;;;;;
;;;;;;
;;;;;;
;;;;;;
;;;;;;
;;;;;;
;;;;;;
;;;;;;
;;;;;;
;;;;;;
;;;;;;
;;;;;;
;;;;;;
;;;;;;
;;;;;;
;;;;;;
;;;;;;
;;;;;;
;;;;;;
;;;;;;
;;;;;;
;;;;;;
;;;;;;
;;;;;;
;;;;;;
;;;;;;
;;;;;;
;;;;;;
;;;;;;
;;;;;;
;;;;;;
;;;;;;
;;;;;;
;;;;;;
;;;;;;
;;;;;;
;;;;;;
;;;;;;
;;;;;;
;;;;;;
;;;;;;
;;;;;;
;;;;;;
;;;;;;
;;;;;;
;;;;;;
;;;;;;
;;;;;;
;;;;;;
;;;;;;
;;;;;;
;;;;;;
;;;;;;
;;;;;;
;;;;;;
;;;;;;
;;;;;;
;;;;;;
;;;;;;
;;;;;;
;;;;;;
;;;;;;
;;;;;;
;;;;;;
;;;;;;
;;;;;;
;;;;;;
;;;;;;
;;;;;;
;;;;;;
;;;;;;
;;;;;;
;;;;;;
;;;;;;
;;;;;;
;;;;;;
;;;;;;
;;;;;;
;;;;;;
;;;;;;
;;;;;;
;;;;;;
;;;;;;
;;;;;;
;;;;;;
;;;;;;
;;;;;;
;;;;;;
;;;;;;
;;;;;;
;;;;;;
;;;;;;
;;;;;;
;;;;;;
;;;;;;
;;;;;;
;;;;;;
;;;;;;
;;;;;;
;;;;;;
;;;;;;
;;;;;;
;;;;;;
;;;;;;
;;;;;;
;;;;;;
;;;;;;
;;;;;;
;;;;;;
;;;;;;
;;;;;;
;;;;;;
;;;;;;
;;;;;;
;;;;;;
;;;;;;
;;;;;;
;;;;;;
;;;;;;
;;;;;;
;;;;;;
;;;;;;
;;;;;;
;;;;;;
;;;;;;
;;;;;;
;;;;;;
;;;;;;
;;;;;;
;;;;;;
;;;;;;
;;;;;;
;;;;;;
;;;;;;
;;;;;;
;;;;;;
;;;;;;
;;;;;;
;;;;;;
;;;;;;
;;;;;;
;;;;;;
;;;;;;
;;;;;;
;;;;;;
;;;;;;
;;;;;;
;;;;;;
;;;;;;
;;;;;;
;;;;;;
;;;;;;
;;;;;;
;;;;;;
;;;;;;
;;;;;;
;;;;;;
;;;;;;
;;;;;;
;;;;;;
;;;;;;
;;;;;;
;;;;;;
;;;;;;
;;;;;;
;;;;;;
;;;;;;
;;;;;;
;;;;;;
;;;;;;
;;;;;;
;;;;;;
;;;;;;
;;;;;;
;;;;;;
;;;;;;
;;;;;;
;;;;;;
;;;;;;
;;;;;;
;;;;;;
;;;;;;
;;;;;;
;;;;;;
;;;;;;
;;;;;;
;;;;;;
;;;;;;
;;;;;;
;;;;;;
;;;;;;
;;;;;;
;;;;;;
;;;;;;
;;;;;;
;;;;;;
;;;;;;
;;;;;;
;;;;;;
;;;;;;
;;;;;;
;;;;;;
;;;;;;
;;;;;;
;;;;;;
;;;;;;
;;;;;;
;;;;;;
;;;;;;
;;;;;;
;;;;;;
;;;;;;
;;;;;;
;;;;;;
;;;;;;
;;;;;;
;;;;;;
;;;;;;
;;;;;;
;;;;;;
;;;;;;
;;;;;;
;;;;;;
;;;;;;
;;;;;;
;;;;;;
;;;;;;
;;;;;;
;;;;;;
;;;;;;
;;;;;;
;;;;;;
;;;;;;
;;;;;;
;;;;;;
;;;;;;
;;;;;;
;;;;;;
;;;;;;
;;;;;;
;;;;;;
;;;;;;
;;;;;;
;;;;;;
;;;;;;
;;;;;;
;;;;;;
;;;;;;
;;;;;;
;;;;;;
;;;;;;
;;;;;;
;;;;;;
;;;;;;
;;;;;;
;;;;;;
;;;;;;
;;;;;;
;;;;;;
;;;;;;
;;;;;;
;;;;;;
;;;;;;
;;;;;;
;;;;;;
;;;;;;
;;;;;;
;;;;;;
;;;;;;
;;;;;;
;;;;;;
;;;;;;
;;;;;;
;;;;;;
;;;;;;
;;;;;;
;;;;;;
;;;;;;
;;;;;;
;;;;;;
;;;;;;
;;;;;;
;;;;;;
;;;;;;
;;;;;;
;;;;;;
;;;;;;
;;;;;;
;;;;;;
;;;;;;
;;;;;;
;;;;;;
;;;;;;
;;;;;;
;;;;;;
;;;;;;
;;;;;;
;;;;;;
;;;;;;
;;;;;;
;;;;;;
;;;;;;
;;;;;;
;;;;;;
;;;;;;
;;;;;;
;;;;;;
;;;;;;
;;;;;;
;;;;;;
;;;;;;
;;;;;;
;;;;;;
;;;;;;
;;;;;;
;;;;;;
;;;;;;
;;;;;;
;;;;;;
;;;;;;
;;;;;;
;;;;;;
;;;;;;
;;;;;;
;;;;;;
;;;;;;
;;;;;;
;;;;;;
;;;;;;
;;;;;;
;;;;;;
;;;;;;
;;;;;;
;;;;;;
;;;;;;
;;;;;;
;;;;;;
;;;;;;
;;;;;;
;;;;;;
;;;;;;
;;;;;;
;;;;;;
;;;;;;
;;;;;;
;;;;;;
;;;;;;
;;;;;;
;;;;;;
;;;;;;
;;;;;;
;;;;;;
;;;;;;
;;;;;;
;;;;;;
;;;;;;
;;;;;;
;;;;;;
;;;;;;
;;;;;;
;;;;;;
;;;;;;
;;;;;;
;;;;;;
;;;;;;
;;;;;;
;;;;;;
;;;;;;
;;;;;;
;;;;;;
;;;;;;
;;;;;;
;;;;;;
;;;;;;
;;;;;;
;;;;;;
;;;;;;
;;;;;;
;;;;;;
;;;;;;
;;;;;;
;;;;;;
;;;;;;
;;;;;;
;;;;;;
;;;;;;
;;;;;;
;;;;;;
;;;;;;
;;;;;;
;;;;;;
;;;;;;
;;;;;;
;;;;;;
;;;;;;
;;;;;;
;;;;;;
;;;;;;
;;;;;;
;;;;;;
;;;;;;
;;;;;;
;;;;;;
;;;;;;
;;;;;;
;;;;;;
;;;;;;
;;;;;;
;;;;;;
;;;;;;
;;;;;;
;;;;;;
;;;;;;
